{
  "id": "mistral-7b-v0-1",
  "name": "Mistral 7B (v0.1)",
  "developer": "Mistral AI",
  "release_date": {
    "value": "2023-09-27",
    "source": "https://mistral.ai/news/announcing-mistral-7b",
    "status": "recorded"
  },
  "weights_status": "open",
  "license": {
    "value": "Apache 2.0",
    "source": "https://mistral.ai/news/announcing-mistral-7b",
    "status": "recorded"
  },
  "architecture": {
    "family": "decoder_only",
    "n_layers": {
      "value": 32,
      "source": "https://huggingface.co/mistralai/Mistral-7B-v0.1/raw/27d67f1b5f57dc0953326b2601d68371d40ea8da/config.json",
      "status": "recorded"
    },
    "hidden_size": {
      "value": 4096,
      "source": "https://huggingface.co/mistralai/Mistral-7B-v0.1/raw/27d67f1b5f57dc0953326b2601d68371d40ea8da/config.json",
      "status": "recorded"
    },
    "n_heads": {
      "value": 32,
      "source": "https://huggingface.co/mistralai/Mistral-7B-v0.1/raw/27d67f1b5f57dc0953326b2601d68371d40ea8da/config.json",
      "status": "recorded"
    },
    "vocab_size": {
      "value": 32000,
      "source": "https://huggingface.co/mistralai/Mistral-7B-v0.1/raw/27d67f1b5f57dc0953326b2601d68371d40ea8da/config.json",
      "status": "recorded"
    },
    "positional_encoding": {
      "value": "rotary (RoPE)",
      "source": "https://huggingface.co/mistralai/Mistral-7B-v0.1/raw/27d67f1b5f57dc0953326b2601d68371d40ea8da/config.json",
      "status": "recorded"
    },
    "context_length": {
      "value": 32768,
      "source": "https://huggingface.co/mistralai/Mistral-7B-v0.1/raw/27d67f1b5f57dc0953326b2601d68371d40ea8da/config.json",
      "status": "recorded"
    },
    "n_kv_heads": {
      "value": 8,
      "source": "https://huggingface.co/mistralai/Mistral-7B-v0.1/raw/27d67f1b5f57dc0953326b2601d68371d40ea8da/config.json",
      "status": "recorded"
    },
    "sliding_window": {
      "value": 4096,
      "source": "https://huggingface.co/mistralai/Mistral-7B-v0.1/raw/27d67f1b5f57dc0953326b2601d68371d40ea8da/config.json",
      "status": "recorded"
    },
    "note": "Paper: grouped-query attention + sliding window attention. context_length is config max_position_embeddings; effective attention span is governed by the 4096 sliding window."
  },
  "training_data": {
    "value": null,
    "source": "https://mistral.ai/news/announcing-mistral-7b",
    "status": "not_recorded",
    "note": "Neither the release post nor the paper discloses the pretraining corpus."
  },
  "techniques": [
    "transformer-decoder",
    "rotary-position-embedding",
    "rmsnorm",
    "swiglu",
    "grouped-query-attention",
    "sliding-window-attention"
  ],
  "primary_sources": [
    "https://arxiv.org/abs/2310.06825",
    "https://mistral.ai/news/announcing-mistral-7b",
    "https://huggingface.co/mistralai/Mistral-7B-v0.1/raw/27d67f1b5f57dc0953326b2601d68371d40ea8da/config.json"
  ],
  "record_history": [
    {
      "date": "2026-09-24",
      "change": "created from primary sources (Phase 1 seed, batch 1)",
      "by": "wilson-pruitt + claude"
    }
  ]
}
